Question,Answer
What services do you offer?,"We offer high-quality laboratory chemicals, advanced analytical instruments, and custom chemical solutions tailored to your needs."
What industries do you serve?,"We serve industries such as pharmaceuticals, biotechnology, research institutions, universities, and chemical manufacturing."
Where are you located?,"Our office is located at 22 Abkari Rd, New Anarkali, Lahore, Punjab 54000, Pakistan."
What are your working hours?,"Our office is open from Monday to Friday, 11:00 AM to 9:00 PM. We are closed on weekends."
How can I contact you?,"You can reach us at +92 324 4715848 or email us at imfscientificcompany@gmail.com."
Do you sell laboratory chemicals?,"Yes, we provide a wide range of high-quality laboratory chemicals for research and industrial use."
Do you offer industrial chemicals?,"Yes, we supply industrial chemicals for various applications, including manufacturing and processing."
Can I get custom chemical formulations?,"Absolutely! We specialize in creating custom chemical solutions tailored to your specific requirements."
Do you provide analytical instruments?,"Yes, we offer advanced analytical instruments for laboratory and industrial use."
What brands do you work with?,"We partner with reputable brands like Caisson Labs, Ambeed, Sigma Aldrich, and BioShop."
How can I place an order?,"You can place an order by contacting us at +92 324 4715848 or emailing imfscientificcompany@gmail.com."
Do you offer international shipping?,"Currently, we provide shipping within Pakistan. For international inquiries, please contact us directly."
What is your delivery time?,"Delivery times vary depending on your location. Typically, orders are delivered within 3-5 business days."
Can I track my order?,"Yes, once your order is shipped, we will provide you with a tracking number."
What payment methods do you accept?,"We accept bank transfers, credit/debit cards, and cash on delivery."
Do you provide technical support for your products?,"Yes, we offer 24/7 technical support for all our products. Contact us at +92 324 4715848."
Can you help me set up laboratory equipment?,"Yes, our team can assist you with the setup and calibration of laboratory equipment."
Do you offer training for using your instruments?,"Yes, we provide training sessions for our clients to ensure proper use of our instruments."
What if I have issues with a product?,"If you encounter any issues, please contact our support team immediately. We offer replacements or refunds for defective products."
Do you provide product warranties?,"Yes, most of our products come with a warranty. Please check the product details or contact us for more information."
Are your prices competitive?,"Yes, we offer high-quality products at competitive prices. Contact us for a detailed quote."
Do you offer discounts for bulk orders?,"Yes, we provide discounts for bulk orders. Please contact us for more details."
Can I get a price list?,"Yes, you can request a price list by emailing us at imfscientificcompany@gmail.com."
Do you have any ongoing promotions?,"Please check our website or contact us to learn about current promotions and discounts."
Is there a minimum order quantity?,"The minimum order quantity varies by product. Contact us for specific details."
How long has IMF Scientific been in business?,"We have been providing innovative chemical solutions for over 10 years."
What makes IMF Scientific different from competitors?,"We offer high-quality products, competitive pricing, and exceptional customer service tailored to your needs."
Do you have a catalog of your products?,"Yes, you can download our product catalog from our website or request it via email."
Can I visit your office?,"Yes, you are welcome to visit our office at 22 Abkari Rd, New Anarkali, Lahore, Punjab 54000, Pakistan."
Do you collaborate with universities or research institutions?,"Yes, we collaborate with universities and research institutions to provide specialized solutions."
Do you offer training programs?,"Yes, we offer training programs for laboratory techniques, equipment usage, and chemical safety."
Can I enroll in your training programs?,"Yes, please contact us at +92 324 4715848 to enroll in our training programs."
Do you provide certificates after training?,"Yes, we provide certificates upon successful completion of our training programs."
Are your training programs online or in-person?,"We offer both online and in-person training programs. Contact us for more details."
What topics do your training programs cover?,"Our training programs cover topics like molecular biology, chemical analysis, and laboratory safety."
Do you offer internships?,"Yes, we offer internships for students and recent graduates. Contact us for more information."
Can I partner with IMF Scientific?,"Yes, we welcome partnerships. Please email us at imfscientificcompany@gmail.com to discuss collaboration opportunities."
Do you have a newsletter?,"Yes, you can subscribe to our newsletter for updates on new products, promotions, and industry news."
How can I stay updated about your products?,"Follow us on social media or subscribe to our newsletter for the latest updates."
Do you provide consultations?,"Yes, we offer free consultations to help you find the right products and solutions for your needs."
Do you offer environmental testing services?,"Yes, we provide environmental testing services to analyze air, water, and soil samples."
Can you help with quality control in manufacturing?,"Yes, we offer quality control solutions and testing services for manufacturing processes."
Do you provide safety training for laboratories?,"Yes, we offer comprehensive safety training programs for laboratory personnel."
Can you assist with regulatory compliance?,"Yes, we provide guidance and solutions to help you comply with industry regulations."
Do you offer chemical storage solutions?,"Yes, we provide safe and compliant chemical storage solutions for laboratories and industries."
Can you help with waste disposal?,"Yes, we offer chemical waste disposal services to ensure safe and environmentally friendly practices."
Do you provide calibration services?,"Yes, we offer calibration services for laboratory instruments to ensure accuracy."
Can you help with laboratory design?,"Yes, we provide consultation services for designing efficient and safe laboratory spaces."
Do you offer emergency response services?,"Yes, we provide emergency response services for chemical spills and accidents."
Can you help with chemical inventory management?,"Yes, we offer solutions for managing and tracking chemical inventories."
Do you provide material safety data sheets (MSDS)?,"Yes, we provide MSDS for all chemicals and products we supply."
Can you help with chemical procurement?,"Yes, we assist with sourcing and procuring chemicals and laboratory supplies."
Do you offer chemical synthesis services?,"Yes, we provide custom chemical synthesis services for research and industrial applications."
Can you help with method development?,"Yes, we offer method development services for analytical and research purposes."
Do you provide stability testing services?,"Yes, we offer stability testing for pharmaceuticals and chemicals."
Can you help with formulation development?,"Yes, we assist in developing formulations for pharmaceuticals, cosmetics, and industrial products."
Do you offer contract research services?,"Yes, we provide contract research services for specialized projects."
Can you help with patent support?,"Yes, we offer support for patent applications related to chemical innovations."
Do you provide chemical analysis services?,"Yes, we offer chemical analysis services for quality control and research purposes."
Can you help with process optimization?,"Yes, we provide process optimization services for manufacturing and research."
Do you offer troubleshooting services?,"Yes, we offer troubleshooting services for laboratory and industrial processes."
Can you help with scale-up of chemical processes?,"Yes, we assist in scaling up chemical processes from lab to production scale."
Do you provide technical documentation?,"Yes, we offer technical documentation for products and processes."
Can you help with validation studies?,"Yes, we provide validation services for analytical methods and processes."
Do you offer risk assessment services?,"Yes, we offer risk assessment services for chemical handling and storage."
Can you help with environmental impact assessments?,"Yes, we provide environmental impact assessments for industrial projects."
Do you offer sustainability consulting?,"Yes, we provide consulting services to help businesses adopt sustainable practices."
Can you help with green chemistry initiatives?,"Yes, we assist in implementing green chemistry practices in research and manufacturing."
Do you provide training on Good Laboratory Practices (GLP)?,"Yes, we offer training programs on GLP for laboratory personnel."
Can you help with ISO certification?,"Yes, we provide guidance and support for obtaining ISO certifications."
Do you offer auditing services?,"Yes, we offer auditing services for quality management systems and laboratory practices."
Can you help with data integrity in laboratories?,"Yes, we provide solutions to ensure data integrity in laboratory operations."
Do you offer software for laboratory management?,"Yes, we provide software solutions for managing laboratory workflows and data."
Can you help with laboratory accreditation?,"Yes, we assist laboratories in achieving accreditation from recognized bodies."
Do you provide consulting for start-ups?,"Yes, we offer consulting services for start-ups in the chemical and life sciences sectors."
Can you help with grant writing for research projects?,"Yes, we provide support for writing grant proposals for research funding."
Do you offer market research services?,"Yes, we provide market research services for the chemical and pharmaceutical industries."
Can you help with product registration?,"Yes, we assist with product registration for pharmaceuticals and chemicals."
Do you provide legal support for intellectual property?,"Yes, we offer legal support for protecting intellectual property in the chemical sector."
Can you help with technology transfer?,"Yes, we assist in transferring technology from research to commercial applications."
Do you offer consulting for regulatory submissions?,"Yes, we provide consulting services for preparing regulatory submissions."
Can you help with clinical trial support?,"Yes, we offer support for clinical trials, including chemical analysis and documentation."
Do you provide consulting for mergers and acquisitions?,"Yes, we offer consulting services for mergers and acquisitions in the chemical industry."
Can you help with supply chain optimization?,"Yes, we provide solutions for optimizing supply chains in the chemical sector."
Do you offer consulting for export and import regulations?,"Yes, we provide guidance on export and import regulations for chemicals."
Can you help with crisis management?,"Yes, we offer crisis management services for chemical-related emergencies."
Do you provide consulting for corporate social responsibility (CSR)?,"Yes, we offer consulting services for implementing CSR initiatives in the chemical industry."
Do you offer chemical safety training?,"Yes, we provide comprehensive chemical safety training for laboratory and industrial personnel."
Can you help with chemical spill cleanup?,"Yes, we offer emergency response services for chemical spill cleanup and containment."
Do you provide chemical storage cabinets?,"Yes, we supply chemical storage cabinets that meet safety and compliance standards."
Can you help with laboratory ventilation design?,"Yes, we offer consulting services for designing efficient laboratory ventilation systems."
Do you provide fume hoods?,"Yes, we supply fume hoods for safe chemical handling in laboratories."
Can you help with chemical waste recycling?,"Yes, we offer solutions for recycling and repurposing chemical waste."
Do you provide chemical labeling services?,"Yes, we offer chemical labeling services to ensure compliance with safety regulations."
Can you help with chemical inventory audits?,"Yes, we provide auditing services for chemical inventory management."
Do you offer chemical compatibility testing?,"Yes, we offer testing services to determine chemical compatibility for storage and use."
Can you help with chemical process optimization?,"Yes, we provide optimization services for chemical manufacturing processes."
Do you offer chemical stability studies?,"Yes, we conduct stability studies to determine the shelf life of chemicals."
Can you help with chemical hazard assessments?,"Yes, we provide hazard assessments to identify and mitigate risks in chemical handling."
Do you provide chemical transport services?,"Yes, we offer safe and compliant chemical transport services."
Can you help with chemical packaging?,"Yes, we provide custom packaging solutions for chemicals to ensure safety during transport."
Do you offer chemical decontamination services?,"Yes, we provide decontamination services for laboratories and industrial facilities."
Can you help with chemical exposure monitoring?,"Yes, we offer monitoring services to assess chemical exposure levels in workplaces."
Do you provide chemical safety data sheets (SDS)?,"Yes, we provide SDS for all chemicals we supply."
Can you help with chemical emergency planning?,"Yes, we offer consulting services for developing chemical emergency response plans."
Do you offer chemical risk management services?,"Yes, we provide risk management solutions for chemical handling and storage."
Can you help with chemical regulatory compliance?,"Yes, we offer consulting services to ensure compliance with chemical regulations."
Do you provide chemical testing kits?,"Yes, we supply testing kits for various chemical analyses."
Can you help with chemical process scale-up?,"Yes, we assist in scaling up chemical processes from lab to production scale."
Do you offer chemical consulting for start-ups?,"Yes, we provide consulting services for start-ups in the chemical industry."
Can you help with chemical patent applications?,"Yes, we offer support for filing chemical-related patent applications."
Do you provide chemical market analysis?,"Yes, we offer market analysis services for the chemical industry."
Can you help with chemical product development?,"Yes, we assist in developing new chemical products for various industries."
Do you offer chemical training for regulatory compliance?,"Yes, we provide training programs to help businesses comply with chemical regulations."
Can you help with chemical supply chain management?,"Yes, we offer solutions for managing chemical supply chains efficiently."
Do you provide chemical consulting for mergers and acquisitions?,"Yes, we offer consulting services for mergers and acquisitions in the chemical sector."
Can you help with chemical technology transfer?,"Yes, we assist in transferring chemical technologies from research to commercial applications."
Do you offer chemical consulting for sustainability?,"Yes, we provide consulting services to help businesses adopt sustainable chemical practices."
Can you help with chemical waste minimization?,"Yes, we offer solutions for minimizing chemical waste in laboratories and industries."
Do you provide chemical consulting for green chemistry?,"Yes, we offer consulting services to implement green chemistry principles."
Can you help with chemical process safety management?,"Yes, we provide consulting services for chemical process safety management."
Do you offer chemical consulting for environmental impact?,"Yes, we provide consulting services to assess and mitigate the environmental impact of chemicals."
Can you help with chemical consulting for product registration?,"Yes, we offer consulting services for registering chemical products in various markets."
Do you provide chemical consulting for quality assurance?,"Yes, we offer consulting services to ensure quality assurance in chemical manufacturing."
Can you help with chemical consulting for regulatory submissions?,"Yes, we provide consulting services for preparing regulatory submissions for chemicals."
Do you offer chemical consulting for crisis management?,"Yes, we provide consulting services for managing chemical-related crises."
Can you help with chemical consulting for corporate social responsibility?,"Yes, we offer consulting services for implementing CSR initiatives in the chemical industry."
Do you provide chemical consulting for export and import regulations?,"Yes, we offer consulting services for navigating export and import regulations for chemicals."
Can you help with chemical consulting for intellectual property?,"Yes, we provide consulting services for protecting intellectual property in the chemical sector."
Do you offer chemical consulting for clinical trials?,"Yes, we provide consulting services for chemical analysis and documentation in clinical trials."
Can you help with chemical consulting for mergers and acquisitions?,"Yes, we offer consulting services for mergers and acquisitions in the chemical industry."
Do you provide chemical consulting for supply chain optimization?,"Yes, we offer consulting services for optimizing chemical supply chains."
Can you help with chemical consulting for process validation?,"Yes, we provide consulting services for validating chemical manufacturing processes."
Do you offer chemical consulting for data integrity?,"Yes, we provide consulting services to ensure data integrity in chemical research and manufacturing."
Can you help with chemical consulting for laboratory accreditation?,"Yes, we offer consulting services for achieving laboratory accreditation in the chemical sector."
Do you provide chemical consulting for start-up funding?,"Yes, we offer consulting services to help chemical start-ups secure funding."
Can you help with chemical consulting for market entry?,"Yes, we provide consulting services for entering new markets with chemical products."
Do you offer chemical consulting for product lifecycle management?,"Yes, we provide consulting services for managing the lifecycle of chemical products."
Can you help with chemical consulting for regulatory audits?,"Yes, we offer consulting services for preparing for and managing regulatory audits."
Do you provide chemical consulting for crisis communication?,"Yes, we offer consulting services for managing communication during chemical-related crises."
Can you help with chemical consulting for sustainability reporting?,"Yes, we provide consulting services for preparing sustainability reports in the chemical industry."
Do you offer chemical consulting for environmental compliance?,"Yes, we provide consulting services to ensure compliance with environmental regulations."
Can you help with chemical consulting for health and safety audits?,"Yes, we offer consulting services for conducting health and safety audits in chemical facilities."
Do you provide chemical consulting for process improvement?,"Yes, we offer consulting services for improving chemical manufacturing processes."
Can you help with chemical consulting for waste management?,"Yes, we provide consulting services for managing chemical waste in compliance with regulations."
Do you offer chemical consulting for energy efficiency?,"Yes, we provide consulting services for improving energy efficiency in chemical manufacturing."
Can you help with chemical consulting for water treatment?,"Yes, we offer consulting services for water treatment in chemical processes."
Do you provide chemical consulting for air quality management?,"Yes, we offer consulting services for managing air quality in chemical facilities."
Can you help with chemical consulting for occupational health?,"Yes, we provide consulting services for improving occupational health in chemical workplaces."
Do you offer chemical consulting for fire safety?,"Yes, we provide consulting services for fire safety in chemical facilities."
Can you help with chemical consulting for emergency preparedness?,"Yes, we offer consulting services for preparing for chemical-related emergencies."
Do you provide chemical consulting for risk assessment?,"Yes, we offer consulting services for conducting risk assessments in chemical facilities."
Can you help with chemical consulting for incident investigation?,"Yes, we provide consulting services for investigating chemical-related incidents."
Do you offer chemical consulting for safety culture development?,"Yes, we provide consulting services for developing a strong safety culture in chemical workplaces."
Can you help with chemical consulting for training program development?,"Yes, we offer consulting services for developing training programs for chemical safety."
Do you provide chemical consulting for regulatory updates?,"Yes, we offer consulting services to keep businesses updated on chemical regulations."
Can you help with chemical consulting for compliance audits?,"Yes, we provide consulting services for conducting compliance audits in chemical facilities."
Do you offer chemical consulting for environmental monitoring?,"Yes, we provide consulting services for monitoring environmental impact in chemical facilities."
Can you help with chemical consulting for sustainability certifications?,"Yes, we offer consulting services for obtaining sustainability certifications in the chemical industry."
Do you provide chemical consulting for carbon footprint reduction?,"Yes, we offer consulting services for reducing the carbon footprint of chemical processes."
Can you help with chemical consulting for renewable energy integration?,"Yes, we provide consulting services for integrating renewable energy into chemical manufacturing."
Do you offer chemical consulting for circular economy practices?,"Yes, we provide consulting services for implementing circular economy practices in the chemical industry."
Can you help with chemical consulting for waste-to-energy projects?,"Yes, we offer consulting services for developing waste-to-energy projects in the chemical sector."
Do you provide chemical consulting for green supply chain management?,"Yes, we offer consulting services for managing green supply chains in the chemical industry."
Can you help with chemical consulting for eco-friendly product development?,"Yes, we provide consulting services for developing eco-friendly chemical products."
Do you offer chemical consulting for sustainable packaging?,"Yes, we provide consulting services for designing sustainable packaging for chemical products."
Can you help with chemical consulting for life cycle assessment?,"Yes, we offer consulting services for conducting life cycle assessments of chemical products."
Do you provide chemical consulting for environmental product declarations?,"Yes, we offer consulting services for preparing environmental product declarations for chemicals."
Can you help with chemical consulting for carbon credit trading?,"Yes, we provide consulting services for participating in carbon credit trading programs."
Do you offer chemical consulting for renewable raw materials?,"Yes, we provide consulting services for sourcing and using renewable raw materials in chemical processes."
Can you help with chemical consulting for biodegradable products?,"Yes, we offer consulting services for developing biodegradable chemical products."
Do you provide chemical consulting for zero-waste initiatives?,"Yes, we offer consulting services for implementing zero-waste initiatives in chemical facilities."
Can you help with chemical consulting for sustainable manufacturing?,"Yes, we provide consulting services for adopting sustainable manufacturing practices in the chemical industry."
Do you offer chemical consulting for green chemistry certifications?,"Yes, we provide consulting services for obtaining green chemistry certifications."
Can you help with chemical consulting for sustainable innovation?,"Yes, we offer consulting services for fostering sustainable innovation in the chemical sector."
Do you provide chemical consulting for climate change mitigation?,"Yes, we offer consulting services for developing strategies to mitigate climate change in the chemical industry."
Can you help with chemical consulting for energy transition?,"Yes, we provide consulting services for transitioning to renewable energy in chemical manufacturing."
Do you offer chemical consulting for sustainable development goals?,"Yes, we provide consulting services for aligning chemical processes with sustainable development goals."